{
  "schemaVersion": 1,
  "avatar": {
    "source": "animations/idle/frame_00.png",
    "crop": [0.29, 0.04, 0.71, 0.39],
    "shape": "circle"
  },
  "supportedModes": [
    "GRAVITY",
    "BORDER_WALK",
    "BORDER_RUN",
    "HIDE_SEEK",
    "BOMBER",
    "SNAKE"
  ],
  "accentColor": "#8B3A4B",
  "foodColor": "#D9A441",
  "bombColor": "#31584B"
}
